{
  "$schema": "https://json-schema.org/draft/2020-12/schema",
  "$id": "https://schemas.holobike.local/HolobikeDeployment/Schemas/integration.schema.json",
  "title": "Per-repository integration contract",
  "description": "One Stack leaf's drive contract as data. The integration name is the closed roster's; the repository is the checkout directory name under its kit; entry points are repository-owned, documented commands — argv executed with the checkout as working directory, no shell. A missing entry point is a recorded absence, never a license for the Assembler to improvise one.",
  "type": "object",
  "additionalProperties": false,
  "required": ["schema_version", "integration", "kit", "repository"],
  "properties": {
    "schema_version": { "const": 1 },
    "integration": {
      "enum": [
        "uroborOS",
        "HexAtlas",
        "Assetscape",
        "HolobikeCore",
        "AthleteIdentity",
        "drAIs",
        "HolobikeExperience",
        "HolobikeDevice",
        "HolobikeRider",
        "HolobikeWorlds"
      ]
    },
    "kit": {
      "enum": ["ai_kit", "bike_kit", "geo_kit", "id_kit", "os_kit", "ue_kit"]
    },
    "repository": {
      "type": "string",
      "minLength": 1,
      "pattern": "^[A-Za-z0-9._-]+$",
      "description": "The checkout directory name under the kit; preflight cross-checks it against the environment mapping's declared path."
    },
    "origin": {
      "type": "string",
      "minLength": 1,
      "pattern": "^\\S+$",
      "description": "The canonical clone source. bootstrap clones a missing checkout from it; an integration without one cannot be materialized, only reported."
    },
    "entry_points": {
      "type": "object",
      "additionalProperties": false,
      "properties": {
        "prove": {
          "type": "object",
          "additionalProperties": false,
          "required": ["argv"],
          "properties": {
            "argv": { "$ref": "#/$defs/argv" }
          }
        },
        "build": {
          "type": "object",
          "additionalProperties": false,
          "required": ["steps"],
          "properties": {
            "steps": {
              "type": "array",
              "minItems": 1,
              "items": {
                "type": "object",
                "additionalProperties": false,
                "required": ["argv"],
                "properties": {
                  "argv": { "$ref": "#/$defs/argv" }
                }
              }
            }
          }
        },
        "serve": { "$ref": "#/$defs/command" },
        "probe": { "$ref": "#/$defs/command" }
      }
    },
    "artifacts": {
      "type": "array",
      "minItems": 1,
      "description": "Checkout-relative paths of the outputs assemble stages into a bundle after a successful build. Never absolute, never escaping.",
      "items": { "type": "string", "minLength": 1 }
    }
  },
  "$defs": {
    "argv": {
      "type": "array",
      "minItems": 1,
      "items": { "type": "string", "minLength": 1 }
    },
    "command": {
      "type": "object",
      "additionalProperties": false,
      "required": ["argv"],
      "description": "A long-running serve or a health probe. argv may reference ${BUNDLE} (the member's staged artifact directory) and ${STATE} (a per-run writable root); the working directory is always ${STATE}. env is a non-secret overlay — the no-secrets rule applies to it in full.",
      "properties": {
        "argv": { "$ref": "#/$defs/argv" },
        "env": {
          "type": "object",
          "propertyNames": { "minLength": 1 },
          "additionalProperties": { "type": "string" }
        }
      }
    }
  }
}
